Country,Rank,Company,Industry,Location,Employees,S1_OpEx,S2_Size,S3_Minitab,S4_Azure,S5_Reach,Total_Score,Market_Tier,Segment,Pitch_Angle,Notes
Switzerland,1,Sensirion AG,Electronics/Sensors,Stäfa,1200,5,5,5,5,5,25,2,HOT,IoT CI culture,"CI core tenet; Azure via Connected Solutions"
Switzerland,2,u-blox AG,Electronics/Semi,Thalwil,1400,5,5,5,5,4,24,2,HOT,Silicon-to-Cloud,"OpEx strategic pillar; heavy Azure for IoT"
Switzerland,3,Medela AG,Medical Devices,Baar,1500,5,5,4,5,4,23,2,HOT,LSS Black Belt,"Hiring LSS BBs; Global OpEx roles"
Switzerland,4,Georg Fischer (GF),Industrial Machinery,Schaffhausen,15000,5,4,4,5,4,22,2,HOT,Strategy 2025 OpEx,"Decentralized divisions ideal for adoption"
Switzerland,5,Bühler Group,Industrial Machinery,Uzwil,12000,5,4,4,5,4,22,2,HOT,Bühler Insights Azure,"Plant Companion CI; dual-use potential"
Switzerland,6,Straumann Group,Medical Devices,Basel,10000,5,4,4,5,4,22,2,HOT,Digital dentistry,"ClearCorrect thermoforming variation"
Switzerland,7,Sika AG,Chemicals/Construction,Baar,33000,5,4,4,4,4,21,2,HOT,Fast Forward OpEx,"Global Process Owners; efficiency program"
Switzerland,8,Bobst Group,Packaging Machinery,Mex,6000,5,4,4,4,4,21,2,HOT,Bobst Connect Azure,"Azure IoT; OpEx resilience program"
Switzerland,9,Oerlikon,Industrial/Surface,Pfäffikon,12000,5,4,4,4,4,21,2,HOT,OOE global system,"Oerlikon Operational Excellence standardized"
Switzerland,10,Huber+Suhner,Electronics/Connectivity,Herisau,4000,5,5,4,4,3,21,2,HOT,OpEx 3 pillars,"LSS required in job ads"
Switzerland,11,Bachem,Pharma/Biochem,Bubendorf,2000,5,4,3,4,4,20,2,HOT,LSS mandatory,"OpEx key value; data-driven decisions"
Switzerland,12,Schott Schweiz AG,Pharma Packaging,St. Gallen,600,4,5,3,4,4,20,2,HOT,VR + Lean,OpEx internships; automated production
Switzerland,13,Siegfried Holding,Pharma CDMO,Zofingen,3600,5,4,3,4,4,20,2,HOT,Global Head OpEx,"Business Excellence CI culture"
Switzerland,14,Rieter,Textile Machinery,Winterthur,5600,4,4,4,4,4,20,2,HOT,CIP mandated,"Digital spinning suite; online training"
Switzerland,15,TE Connectivity (CH),Electronics/Sensors,Schaffhausen,80000,4,4,4,4,4,20,2,HOT,Smart Factory AI,"OpEx compliance; CI in contracts"
Switzerland,16,Ypsotec AG,Precision Parts,Grenchen,350,3,5,5,3,4,20,2,HOT,MedTech precision,"ISO 13485; constant variation analysis"
Switzerland,17,MPS Micro Precision,Precision Systems,Biel,400,3,5,5,3,4,20,2,HOT,Extreme tolerances,"Watch/MedTech micro-systems"
Switzerland,18,Tornos SA,Machine Tools,Moutier,600,3,5,4,3,4,19,2,WARM,Tornos Academy,"Industry 4.0 ready; data analytics"
Switzerland,19,GDELS-Mowag,Defense/Automotive,Kreuzlingen,900,4,5,4,3,3,19,2,WARM,SAP S/4HANA,"Lean + CI specialist roles"
Switzerland,20,Rheinmetall Air Defence,Defense,Zurich,1000,4,4,4,4,3,19,2,WARM,Digital workflow,"OpEx value streams; supplier audits"
Switzerland,21,RUAG,Defense/Aerospace,Bern,2500,4,4,4,4,3,19,2,WARM,Industry 4.0,"Machine monitoring; CI in supplier contracts"
Switzerland,22,SIG Group,Packaging,Neuhausen,9000,5,3,3,4,4,19,2,WARM,Minitab displace,"OpEx awards; Minitab users"
Switzerland,23,GF Machining Solutions,Machine Tools,Biel,3000,4,4,4,4,3,19,2,WARM,Smart machining,"OpEx + automation pillar"
Switzerland,24,Fehlmann AG,Machine Tools,Seon,200,3,5,5,3,3,19,2,WARM,Family-owned agile,"SME precision; modern controls"
Switzerland,25,Lonza,Pharma/Biotech,Basel,17000,5,3,2,5,3,18,2,WARM,Lean Transformation,"11000 trained in Lean; Azure user"
Switzerland,26,Nestlé,Food & Beverage,Vevey,270000,5,3,2,5,3,18,2,WARM,NCE TPM/Lean,"Strategic MS partner; Azure global"
Switzerland,27,Roche,Pharma/Diagnostics,Basel,100000,5,3,2,5,3,18,2,WARM,Global OpEx dept,"Navify digital; LSS widely adopted"
Switzerland,28,Novartis,Pharma,Basel,76000,5,3,2,5,3,18,2,WARM,OpEx Assoc Dir,"Data enablement; digital transformation"
Switzerland,29,ABB Switzerland,Ind. Automation,Baden,6000,5,3,3,5,2,18,2,WARM,LSS Green Belt,"ABB Ability platform; Azure user"
Switzerland,30,EMS-Chemie,Chemicals/Polymers,Domat/Ems,2700,4,4,3,3,4,18,2,WARM,CI mandated,"OpEx pillar; high efficiency focus"
Switzerland,31,Swatch Group,Watches,Biel,31000,4,3,4,3,3,17,2,WARM,Assembly OpEx,"High QC; vertical integration"
Switzerland,32,Richemont,Luxury Goods,Geneva,37000,4,3,4,3,3,17,2,WARM,SAP/Cloud mfg,"Manufacturing controlling; OpEx via tech"
Switzerland,33,Rolex,Watches,Geneva,30000,4,3,4,3,3,17,2,WARM,Methods Engineer,"Robotics/automation; CI philosophy"
Switzerland,34,Hamilton Bonaduz,MedTech/Lab Auto,Bonaduz,1500,4,5,3,3,2,17,2,WARM,Process validation,"High precision liquid handling"
Switzerland,35,Sonova (Phonak),MedTech/Hearing,Stäfa,16000,4,4,3,3,3,17,2,WARM,Kaizen micro-mfg,"Digital hearing; cloud connectivity"
Switzerland,36,Franke Group,Industrial/Kitchen,Aarburg,8000,4,3,3,3,3,16,2,WARM,Steel production,"OpEx focus; high volume"
Switzerland,37,Emmi Group,Food & Beverage,Lucerne,9000,4,3,2,4,3,16,2,WARM,EOE Lean dairy,"Supply chain digitization"
Switzerland,38,V-ZUG,Appliances,Zug,2000,3,4,3,3,3,16,2,WARM,Swiss Made lean,"Vertical integration; digital production"
Switzerland,39,Meyer Burger,Solar Technology,Thun,1000,3,4,4,3,2,16,2,WARM,Yield management,"High-tech PV; process critical"
Switzerland,40,Patek Philippe,Watches,Geneva,2600,4,3,3,2,3,15,2,WARM,Patek Seal,"Extreme vertical integration"
Switzerland,41,Audemars Piguet,Watches,Le Brassus,2000,3,4,3,3,2,15,2,WARM,Industrializing,"Growing industrialization; tech-forward"
Switzerland,42,Breitling,Watches,Grenchen,1000,3,4,3,3,2,15,2,WARM,COSC focus,"Industrial scaling under PE"
Switzerland,43,IWC Schaffhausen,Watches,Schaffhausen,1000,4,3,3,3,2,15,2,WARM,Richemont stack,"High automation case making"
Switzerland,44,Bell Food Group,Food Processing,Basel,12000,3,3,3,3,3,15,2,WARM,Low-margin OpEx,"Logistics automation; IT modernization"
Switzerland,45,Schindler Group,Elevators,Ebikon,69000,4,2,3,4,2,15,2,WARM,IoEE digital twin,"Internet of Elevators; global industrialization"
Switzerland,46,Endress+Hauser,Measurement,Reinach,15000,4,2,3,4,2,15,2,WARM,Netilion IIoT,"Flow/level sensors; Azure alignment"
Switzerland,47,Belimo,HVAC Actuators,Hinwil,2000,3,4,3,3,2,15,2,WARM,CESIM OpEx,"IoT actuators; cloud connectivity"
Switzerland,48,Jura Elektroapparate,Appliances,Niederbuchsiten,800,3,4,3,3,2,15,2,WARM,Swiss Quality,"Connected coffee machines"
Switzerland,49,Stadler Rail,Transport,Bussnang,13000,3,3,3,3,2,14,2,COOL,Swiss Made rail,"Lean assembly; digital maintenance"
Switzerland,50,dormakaba,Security/Access,Rümlang,15000,3,2,3,3,2,13,2,COOL,Assembly opt,"Digital access solutions"
Switzerland,51,Feldschlösschen,Beverages,Rheinfelden,1200,3,3,2,3,2,13,2,COOL,Carlsberg TPM,"TPM focus; logistics heavy"
Switzerland,52,Biotronik,MedTech,Bülach,5000,4,3,3,3,2,15,2,WARM,Cardiac devices,"Vascular intervention mfg"
