Country,Company,Type,Focus,Location,Notes
Belgium,Stanwick,LSS Training,Top-tier industrial OpEx chemical & manufacturing,Gent,Deeply embedded in chemical/mfg sectors
Belgium,Amelior,LSS Training,Gold Standard Quality/Safety training thousands alumni,Kortrijk,Alumni = thousands of Quality Managers
Belgium,Allanta,LSS Training,Automotive IATF & MedDev statistical focus trains on Minitab,Limburg,Key partner — trains on Minitab → introduce alternative
Belgium,The Lean Six Sigma Company,LSS Training,International belt certification strong local,Antwerp,International with strong local presence
Belgium,Global 6 Sigma,LSS Training,Certification focus capital region,Brussels,Brussels region certification
Belgium,Möbius,Consultancy,Strategic OpEx circular economy government,Ghent,Strong circular economy practice
Belgium,BDO Belgium,Consultancy,Mid-market SME digitization Process & Lean,Various,Helps SMEs digitize operations
Belgium,Mainnovation,Consultancy,Maintenance & Asset Management specialist,Antwerp,Key partner for BEMAS network
Belgium,Agoria,Association,Technology Federation Factory of Future award organizer,Brussels,Must join. FoF award = prospect list ⭐⭐
Belgium,Essenscia,Association,Chemistry & Life Sciences federation,Brussels,Access to Antwerp chemical + Pharma clusters
Belgium,Fevia,Association,Food Industry Federation,Brussels,Reaching fragmented food market
Belgium,BEMAS,Association,Belgian Maintenance Association reliability engineers,Brussels,Reliability engineers network
Belgium,Flanders Make,Research Center,Strategic research center for manufacturing,Leuven,Scientific credibility for partnerships
