Country,Rank,Company,Industry,Location,Employees,S1_OpEx,S2_Size,S3_Minitab,S4_Azure,S5_Reach,Total_Score,Market_Tier,Segment,Pitch_Angle,Notes
Belgium,1,Umicore,Materials/Recycling,Brussels/Hoboken/Olen,5,5,5,5,5,25,7,HOT,Umicore Way + Microsoft AI partnership,"Perfect prospect. Azure AI platform agreement ⭐"
Belgium,2,Vandemoortele,Food,Ghent/Izegem,5,5,4,5,5,24,7,HOT,Factory of Future + Azure case study,"Proven Azure migration. Early adopter ⭐"
Belgium,3,Bekaert,Steel Wire,Zwevegem,5,5,5,5,5,25,7,HOT,WCM + Azure Data Lake TCS case study,"Azure Data Lake ready. HQ in Flanders ⭐"
Belgium,4,BASF Antwerpen,Chemicals,Antwerp,5,5,5,5,4,24,7,HOT,Verbund site inter-plant correlations,"Largest chemical site in Belgium. MS partner"
Belgium,5,Pfizer Puurs,Pharma,Puurs,5,5,5,5,4,24,7,HOT,Factory of Future + CPV forensic tool,"Global vaccine hub. Azure sovereign ⭐"
Belgium,6,Janssen (J&J),Pharma,Beerse/Geel,5,5,5,5,4,24,7,HOT,Factory of Future lighthouse + tech transfer,"Largest pharma employer BE. J&J MS partner"
Belgium,7,UCB Pharma,Pharma,Braine-l'Alleud,5,5,5,5,5,25,7,HOT,SKAI platform on Azure + buy vs build,"BEL20. Deep Azure. Perfect prospect ⭐⭐"
Belgium,8,Atlas Copco Airpower,Industrial,Wilrijk,5,5,5,5,4,24,7,HOT,World-class ops + test stand variation,"Global compressor HQ in Flanders"
Belgium,9,Daikin Europe,HVAC,Ostend,5,5,5,4,5,24,7,HOT,Multiple Factory of Future + heat pump scaling,"Expansion drives variation. Agoria active"
Belgium,10,Ontex,Hygiene,Aalst/Buggenhout,5,5,4,5,5,24,7,HOT,High-speed web + Azure/Inetum migration,"BEL20. Small variation = huge waste"
Belgium,11,Puratos,Food/Ingredients,Groot-Bijgaarden,5,5,4,5,5,24,7,HOT,Purabot Azure OpenAI + fermentation,"Already Azure AI user. Open culture ⭐"
Belgium,12,Takeda Belgium,Pharma,Lessines,5,5,5,4,4,23,7,HOT,Factory of Future + plasma biological var,"Biological variation in plasma fractionation"
Belgium,13,Volvo Car Gent,Automotive,Ghent,5,5,5,4,4,23,7,HOT,EV assembly battery + Lean religion,"Largest industrial employer Flanders"
Belgium,14,Solvay (Syensqo),Chemicals,Brussels/Doel,5,5,5,4,4,23,7,HOT,R&D-to-production scale-up variability,"Global specialty materials. Innovation leader"
Belgium,15,AB InBev,Food/Beverage,Leuven,5,5,5,4,4,23,7,HOT,VPO Tier 2 problem solving multivariate,"World's largest brewer. VPO system"
Belgium,16,Unilin (Mohawk),Flooring,Wielsbeke,5,5,4,5,4,23,7,HOT,Click system precision + hiring OpEx Mgr,"Massive scale. Actively hiring OpEx"
Belgium,17,TE Connectivity,Connectors,Oostkamp,5,4,5,4,4,22,7,HOT,4x Factory of Future + stamping/molding,"High-speed precision. IATF 16949"
Belgium,18,Barry Callebaut,Food/Chocolate,Wieze/Halle,5,5,4,5,4,23,7,HOT,Cocoa variation by crop + digital transf,"World's largest chocolate factory"
Belgium,19,Borealis Polymers,Chemicals,Beringen/Kallo,5,5,4,4,4,22,7,HOT,Grade transition analysis optimization,"OpEx as corporate pillar"
Belgium,20,Covestro,Chemicals,Antwerp,5,5,4,4,4,22,7,HOT,Polymer multivariate quality deviations,"Data-driven production strategy"
Belgium,21,Alpro (Danone),Food,Wevelgem,5,5,4,4,4,22,7,HOT,Factory of Future + enzymatic variation,"Plant-based processing biological reactions"
Belgium,22,Sanofi Belgium (Genzyme),Pharma,Geel,5,5,5,4,3,22,7,HOT,Biologics cell culture batch consistency,"Global procurement may slow local buying"
Belgium,23,CNH Industrial,Automotive/Agri,Zedelgem/Antwerp,5,5,5,4,3,22,7,HOT,WCM gold/silver + loss analysis data,"WCM data-hungry methodology"
Belgium,24,DAF Trucks (PACCAR),Automotive,Westerlo,5,5,5,4,3,22,7,HOT,Axle precision tolerances + tool wear,"Six Sigma standard. Kempen region"
Belgium,25,Audi Brussels,Automotive,Forest,5,5,5,4,3,22,7,HOT,Factory of Future EV + restructuring efficiency,"Burning platform BUT budget freeze risk ⚠️"
Belgium,26,Nitto Belgium,Industrial Tapes,Genk,5,4,4,4,4,21,7,HOT,Coating multivariate + Azumuta digital,"Japanese quality + modern digital shop floor"
Belgium,27,Picanol,Textile Machinery,Ypres,5,4,4,4,4,21,7,HOT,High-tech machinery assembly precision,"Local champion Tessenderlo Group"
Belgium,28,Cargill Belgium,Food,Mechelen/Izegem/Antwerp,5,5,5,4,3,22,7,HOT,Refining/fractionation yield losses,"Huge footprint. Hiring CI Specialists"
Belgium,29,Soudal,Chemicals/Adhesives,Turnhout,4,5,3,5,4,21,7,HOT,Factory of Future + Azure DF/Power BI,"Family-owned = fast decisions. Cloud ready"
Belgium,30,Vandewiele,Textile Machinery,Kortrijk,4,4,4,4,4,20,7,HOT,Complex machine assembly variation,"Family-influenced agile decisions"
Belgium,31,Lonza Bornem,Pharma,Bornem,5,4,4,4,3,20,7,HOT,Capsule defect reduction gelatin variation,"Billions of capsules. Extreme stability"
Belgium,32,Asco Industries,Aerospace,Zaventem,5,4,5,3,3,20,7,HOT,Titanium machining scrap 1% = huge saving,"AS9100 requirement. Airbus/Boeing supplier"
Belgium,33,VCST Industrial,Automotive,Sint-Truiden,5,4,5,4,4,22,7,HOT,Factory of Future gear heat treat variation,"BEMAS member. Precision gears"
Belgium,34,Evonik Antwerpen,Chemicals,Antwerp,4,5,4,4,4,21,7,HOT,Specialty chemicals tight tolerance methionine,"Top Employer. Process eng recruitment"
Belgium,35,Recticel,Insulation,Wetteren/Wevelgem,4,4,4,4,3,19,7,WARM,Foam expansion temp/mix ratio density,"Strategic restructuring ongoing"
Belgium,36,INEOS Belgium,Petrochemicals,Zwijndrecht/Beveren/Geel,4,5,3,4,4,20,7,HOT,Project ONE cracker new digital assets,"Aggressive cost culture. Decentralized"
Belgium,37,FrieslandCampina Belgium,Food/Dairy,Aalter/Lummen,5,5,4,4,2,20,7,HOT,WCOM + CIP cleaning optimization,"Run from NL HQ = harder local buying"
Belgium,38,CommScope,Telecom,Kessel-Lo,5,4,5,4,2,20,7,HOT,Zero defect connectivity Six Sigma,"US reporting lines. Six Sigma essential"
Belgium,39,3M Belgium,Chemicals,Zwijndrecht,5,4,5,4,2,20,7,HOT,3P program LSS + env compliance,"PFAS scrutiny = defensive ⚠️. Environmental pitch"
Belgium,40,Agristo,Food/Potato,Harelbeke/Wielsbeke,4,5,3,4,4,20,7,HOT,Energy per ton optimization frozen potato,"Family business = fast decisions"
Belgium,41,TVH Parts,Logistics/Remfg,Waregem,5,5,2,5,4,21,7,HOT,Remanufacturing QC rebuilt parts,"Logistics excellence. IT = core product"
Belgium,42,B.I.G.,Textiles/Polymers,Waregem,4,5,4,4,4,21,7,HOT,Polymer extrusion to yarn variation unified,"Family group professionalizing"
Belgium,43,Lotus Bakeries,Food,Lembeke,4,5,3,4,5,21,7,HOT,Baking humidity/temp/time correlation,"BEL20. HQ = local decisions"
Belgium,44,Stow Group,Racking/Auto,Spiere-Helkijn,4,4,3,4,3,18,7,WARM,Roll forming steel mill settings,"PE-owned (Blackstone). Bottom line focus"
Belgium,45,Clarebout Potatoes,Food/Potato,Nieuwkerke,4,5,3,3,4,19,7,WARM,Line A vs Line B efficiency 2% gap,"BEMAS member. Energy driven"
Belgium,46,Eastman Chemical,Chemicals,Ghent,4,3,5,4,3,19,7,WARM,Specialty additives high-value batch var,"US Six Sigma culture. Site is smaller"
Belgium,47,Televic,Electronics,Izegem,4,3,3,5,4,19,7,WARM,Electronics assembly yield pick-and-place,"Tech-savvy mid-sized"
Belgium,48,Chevron Phillips,Petrochemicals,Tessenderlo/Beringen,4,4,3,3,4,18,7,WARM,Reliability engineering process conditions,"BEMAS member. Safety culture"
Belgium,49,Agfa-Gevaert,Imaging/Tech,Mortsel,4,4,3,3,4,18,7,WARM,Zirfon H2 membrane new process learning,"Pivot to new tech = high early variation"
Belgium,50,VDL Bus Roeselare,Automotive,Roeselare,4,4,4,3,2,17,7,WARM,Restart lines stability benchmarking,"In transition after acquisition ⚠️"
Belgium,51,Terumo Europe,MedDev,Leuven,5,4,5,4,4,22,7,HOT,Kaizen DNA syringe machine-to-machine var,"ISO 13485. Hiring CI Engineers"
Belgium,52,Kaneka Eurogentec,Pharma/CDMO,Liege,4,4,4,3,4,19,7,WARM,CDMO new product troubleshooting margins,"Fast growing. Seraing"
